{
  "$schema": "../schemas/marketplace.schema.json",
  "name": "ivuorinen-skills",
  "description": "Hostile audit toolkit for Claude Code: adversarial review, security, tests, docs, architecture, reliability and agent-enforcement audits, with a bundled MCP server",
  "license": "MIT",
  "owner": {
    "name": "Ismo Vuorinen",
    "email": "ismo@ivuorinen.net"
  },
  "plugins": [
    {
      "name": "ivuorinen-skills",
      "description": "Nitpicker — hostile audit toolkit: /nitpicker <command> dispatches specialist audit commands (adversarial review, security, tests, docs, types, architecture, perf, reliability, caching, concurrency, error handling, leaks, deps, licensing, CI, commits, migrations, observability, API contracts, a11y, i18n, privacy, config, IaC, prompt safety, installed agent configuration, complexity, dead and unwired code, agent rule and hook enforcement) plus planning, plan execution, teaching, triage and PR review. Bundles a stdio MCP server for skill introspection and findings management.",
      "version": "3.2.0",
      "license": "MIT",
      "source": "./",
      "author": {
        "name": "Ismo Vuorinen",
        "email": "ismo@ivuorinen.net"
      }
    }
  ]
}
